{
 "$schema":"https://json-schema.org/draft/2020-12/schema","type":"object","additionalProperties":false,
 "required":["schema_version","id","recorded_utc","source","choices","authority_boundary"],
 "properties":{
  "schema_version":{"const":"agents-project-decision/v4"},"id":{"type":"string","pattern":"^[A-Za-z0-9_-]+$"},
  "recorded_utc":{"type":"string","format":"date-time"},"source":{"type":"string","minLength":1},
  "choices":{"type":"array","minItems":1,"uniqueItems":true,"items":{"type":"string","minLength":1}},
  "authority_boundary":{"type":"string","minLength":1}
 }
}
